{
  "schema_version": "dashboard_data.v1",
  "generated_at_utc": "2026-06-07T12:00:00Z",
  "source_commit": "01367e6",
  "source_branch": "codex/dashboard-f2-data-contract-validator",
  "dirty_state": "clean",
  "system_posture": "research_only",
  "non_authority_declaration": {
    "read_only_mirror": true,
    "renderer_must_not_invent_facts": true,
    "not_executable": true,
    "not_runtime_authority": true,
    "not_paper_live_authority": true,
    "not_order_authority": true,
    "not_broker_exchange_authority": true,
    "not_ranking_authority": true,
    "not_recommendation_authority": true,
    "not_readiness_authority": true,
    "not_promotion_authority": true,
    "not_transition_authority": true,
    "not_gate_authority": true
  },
  "pages": {
    "overview": {
      "status": "WARN",
      "source_refs": ["status-wp-d4a"],
      "status_cards": [
        {
          "card_id": "data-slice",
          "title": "15m D4 slice",
          "status": "PASS",
          "summary": "D4A committed a valid offline validated Binance USDT-M BTCUSDT 15m slice.",
          "source_refs": ["d4a-catalog"]
        },
        {
          "card_id": "paper-runtime",
          "title": "Paper runtime",
          "status": "NOT_AVAILABLE",
          "summary": "Paper runtime is not available to dashboard_data.",
          "source_refs": ["status-wp-e1"]
        }
      ],
      "warnings": [
        {
          "warning_id": "f2-before-f3",
          "status": "WARN",
          "message": "F2 report-back is required before F3 renderer implementation.",
          "source_refs": ["status-wp-f2"]
        }
      ],
      "latest_data_slice": {
        "status": "PASS",
        "d4_catalog_ref": "binance_usdtm_btcusdt_ohlcv_15m.offline_local.15m.20200101T000000Z.20260411T234500Z.sha256_3daace53d727599b",
        "d4_slice_identity": "binance_usdtm_btcusdt_ohlcv_15m:sha256:3daace53d727599b4cf5cc9d27ac2a3d53997bbf5b8401470097934e776bd664",
        "freshness": {
          "staleness_status": "FRESH",
          "staleness_reason": "Committed D4A catalog slice artifact is present on the source commit.",
          "source_artifact_mtime_utc": null
        },
        "source_refs": ["d4a-catalog"]
      },
      "latest_validation": {
        "status": "PASS",
        "validation_report_ref": "research/data_slices/binance_usdtm_btcusdt_15m/binance_usdtm_btcusdt_15m_20200101_20260411.validation_report.json",
        "validation_report_sha256": "785a8d53797155dcc80e646e8610db8d510825b9fa3dbccd21e79aa2700a6c1c",
        "freshness": {
          "staleness_status": "FRESH",
          "staleness_reason": "Validation report is the D4A source artifact.",
          "source_artifact_mtime_utc": null
        },
        "source_refs": ["d4a-validation"]
      },
      "latest_result_population_empty_state": {
        "status": "NOT_AVAILABLE",
        "message": "No D5 result population yet.",
        "source_refs": ["status-wp-d4a"]
      },
      "paper_runtime_empty_state": {
        "status": "NOT_AVAILABLE",
        "message": "No paper runtime yet.",
        "source_refs": ["status-wp-e1"]
      },
      "live_mode_empty_state": {
        "status": "NOT_AVAILABLE",
        "message": "No live mode.",
        "source_refs": ["status-wp-e1"]
      },
      "open_gates_summary": {
        "status": "BLOCKED",
        "total_gates": 5,
        "counts_by_status": {
          "PASS": 1,
          "WARN": 1,
          "FAIL": 0,
          "BLOCKED": 3,
          "UNKNOWN": 0,
          "NOT_AVAILABLE": 0
        },
        "source_refs": ["status-wp-d4a", "status-wp-f2"]
      }
    },
    "data_provenance": {
      "status": "PASS",
      "source_refs": ["d4a-catalog", "d4a-validation", "d4a-import"],
      "d4_slice": {
        "status": "PASS",
        "catalog_ref": "binance_usdtm_btcusdt_ohlcv_15m.offline_local.15m.20200101T000000Z.20260411T234500Z.sha256_3daace53d727599b",
        "data_slice_identity": "binance_usdtm_btcusdt_ohlcv_15m:sha256:3daace53d727599b4cf5cc9d27ac2a3d53997bbf5b8401470097934e776bd664",
        "catalog_artifact_sha256": "80a080336853ca96c81e2033a381527caec3737c1a817c111fc61d4e8c685327",
        "dataset_id": "binance_usdtm_btcusdt_ohlcv_15m",
        "venue": "Binance",
        "symbol": "BTCUSDT",
        "market_type": "USDT-M perpetual",
        "stream": "ohlcv",
        "timeframe": "15m",
        "row_count": 220128,
        "expected_row_count": 220128,
        "timestamp_range": {
          "start_utc": "2020-01-01T00:00:00Z",
          "end_utc": "2026-04-11T23:45:00Z"
        },
        "gap_facts": {
          "gap_count": 0,
          "missing_bar_count": 0,
          "gaps": [],
          "policy": "detect_report_do_not_fill_or_interpolate"
        },
        "duplicate_facts": {
          "duplicate_group_count": 0,
          "duplicate_row_count": 0,
          "duplicates": [],
          "policy": "detect_report_do_not_deduplicate"
        },
        "raw_source_sha256": "343b639e35ce79824d26bddf6d70af2641c9d76003301e303f83cdf61d4feab4",
        "normalized_sha256": "c30fd7f07fdf513cdaf234b1bee4eff03b430a479cc572a2cc8b57394f22e0ab",
        "source_refs": ["d4a-catalog"]
      },
      "d3_validation_report": {
        "status": "PASS",
        "path": "research/data_slices/binance_usdtm_btcusdt_15m/binance_usdtm_btcusdt_15m_20200101_20260411.validation_report.json",
        "sha256": "785a8d53797155dcc80e646e8610db8d510825b9fa3dbccd21e79aa2700a6c1c",
        "source_refs": ["d4a-validation"]
      },
      "d2_import_report": {
        "status": "PASS",
        "path": "research/data_slices/binance_usdtm_btcusdt_15m/binance_usdtm_btcusdt_15m_20200101_20260411.import_report.json",
        "sha256": "553c320d6639ceca4422f0f08620550c558e05162eb16aff30854db76a7246d3",
        "source_refs": ["d4a-import"]
      },
      "artifact_paths": [
        {
          "artifact_id": "D4A-CATALOG",
          "artifact_type": "catalog_slice",
          "path": "research/data_slices/binance_usdtm_btcusdt_15m/binance_usdtm_btcusdt_15m_20200101_20260411.catalog_slice.json",
          "sha256": "80a080336853ca96c81e2033a381527caec3737c1a817c111fc61d4e8c685327",
          "source_refs": ["d4a-catalog"]
        },
        {
          "artifact_id": "D4A-NORMALIZED-DATA",
          "artifact_type": "normalized_data",
          "path": "data/processed/d4a/binance_um_perp_BTCUSDT_15m_2020-01-01_2026-04-11_d4a_normalized.csv",
          "sha256": "c30fd7f07fdf513cdaf234b1bee4eff03b430a479cc572a2cc8b57394f22e0ab",
          "source_refs": ["d4a-catalog"]
        }
      ],
      "freshness": {
        "staleness_status": "FRESH",
        "staleness_reason": "D4A artifacts are committed under the current base.",
        "source_artifact_mtime_utc": null
      }
    },
    "gates": {
      "status": "BLOCKED",
      "source_refs": ["status-wp-d4a", "status-wp-f2"],
      "gates": [
        {
          "gate_id": "D5A_RUNNER_PROVENANCE_ALIGNMENT",
          "title": "D5A runner provenance alignment",
          "status": "BLOCKED",
          "why_it_matters": "D4A reports the current runner still records fixture-style 15m provenance.",
          "required_human_action": "Authorize and merge a bounded D5A package before any D5 real-data result population.",
          "source_refs": ["status-wp-d4a"],
          "non_authority_note": "This gate is display-only and cannot mutate runner, sweep, paper, or live state."
        },
        {
          "gate_id": "D5_KARL_GATE",
          "title": "D5 Karl gate",
          "status": "BLOCKED",
          "why_it_matters": "D5 requires Karl-gated authorization after honest D4 provenance is available.",
          "required_human_action": "Record the Karl gate decision in a later approved path.",
          "source_refs": ["status-wp-d4a"],
          "non_authority_note": "Dashboard data only mirrors the gate state and does not approve D5."
        },
        {
          "gate_id": "F2_REPORT_BACK_BEFORE_F3",
          "title": "F2 report-back before F3",
          "status": "WARN",
          "why_it_matters": "The renderer must wait for this contract and validator report-back.",
          "required_human_action": "Report F2 contract behavior to Main before drafting F3 renderer work.",
          "source_refs": ["status-wp-f2"],
          "non_authority_note": "This entry creates no renderer authority."
        },
        {
          "gate_id": "PAPER_RUNTIME_IMPLEMENTATION_AUTHORIZATION",
          "title": "Paper-runtime implementation authorization",
          "status": "BLOCKED",
          "why_it_matters": "Paper runtime remains protected until a scoped sandbox package authorizes it.",
          "required_human_action": "Use a later approved paper-risk package if paper runtime implementation is wanted.",
          "source_refs": ["status-wp-e1"],
          "non_authority_note": "This gate cannot start, schedule, or configure paper runtime."
        },
        {
          "gate_id": "LIVE_GATE_PAPER_TO_LIVE_KARL_GATE",
          "title": "Live gate / paper-to-live Karl gate",
          "status": "BLOCKED",
          "why_it_matters": "Live trading remains outside dashboard authority and requires future human gates.",
          "required_human_action": "Keep live mode disabled unless a future approved live-path package changes repo truth.",
          "source_refs": ["status-wp-e1"],
          "non_authority_note": "This gate cannot enable live mode, place orders, or alter broker state."
        }
      ]
    }
  },
  "warnings": [
    {
      "warning_id": "no-renderer",
      "status": "WARN",
      "message": "F2 contains contract data only; renderer implementation remains out of scope.",
      "source_refs": ["status-wp-f2"]
    }
  ],
  "source_refs": [
    {
      "ref_id": "status-wp-d4a",
      "ref_type": "status_entry",
      "path": "docs/status_entries/WP-D4A.md",
      "sha256": null,
      "description": "D4A status entry and D5A runway note."
    },
    {